{
    "version": 2,
    "plugins_root": "/Users/kietnguyen/.gemini/config/github-plugins/develop",
    "design_plugins_root": "/Users/kietnguyen/.gemini/config/github-plugins/design",
    "last_indexed": "2026-10-25T02:41:11Z",
    "plugins": {
        "understand-anything": {
            "path": "Understand-Anything",
            "type": "monorepo",
            "version": "2.9.7",
            "skills": [
                {
                    "name": "understand",
                    "path": "Understand-Anything/understand-anything-plugin/skills/understand/SKILL.md"
                },
                {
                    "name": "understand-chat",
                    "path": "Understand-Anything/understand-anything-plugin/skills/understand-chat/SKILL.md"
                },
                {
                    "name": "understand-dashboard",
                    "path": "Understand-Anything/understand-anything-plugin/skills/understand-dashboard/SKILL.md"
                },
                {
                    "name": "understand-diff",
                    "path": "Understand-Anything/understand-anything-plugin/skills/understand-diff/SKILL.md"
                },
                {
                    "name": "understand-domain",
                    "path": "Understand-Anything/understand-anything-plugin/skills/understand-domain/SKILL.md"
                },
                {
                    "name": "understand-explain",
                    "path": "Understand-Anything/understand-anything-plugin/skills/understand-explain/SKILL.md"
                },
                {
                    "name": "understand-figma",
                    "path": "Understand-Anything/understand-anything-plugin/skills/understand-figma/SKILL.md"
                },
                {
                    "name": "understand-knowledge",
                    "path": "Understand-Anything/understand-anything-plugin/skills/understand-knowledge/SKILL.md"
                },
                {
                    "name": "understand-onboard",
                    "path": "Understand-Anything/understand-anything-plugin/skills/understand-onboard/SKILL.md"
                }
            ],
            "agents": [
                "Understand-Anything/understand-anything-plugin/agents/architecture-analyzer.md",
                "Understand-Anything/understand-anything-plugin/agents/article-analyzer.md",
                "Understand-Anything/understand-anything-plugin/agents/assemble-reviewer.md",
                "Understand-Anything/understand-anything-plugin/agents/design-analyzer.md",
                "Understand-Anything/understand-anything-plugin/agents/domain-analyzer.md",
                "Understand-Anything/understand-anything-plugin/agents/file-analyzer.md",
                "Understand-Anything/understand-anything-plugin/agents/graph-reviewer.md",
                "Understand-Anything/understand-anything-plugin/agents/knowledge-graph-guide.md",
                "Understand-Anything/understand-anything-plugin/agents/project-scanner.md",
                "Understand-Anything/understand-anything-plugin/agents/tour-builder.md"
            ],
            "output": {
                "dir": ".ua/",
                "format": "knowledge-graph.json"
            }
        },
        "graphify": {
            "path": "graphify",
            "type": "python-library",
            "version": "0.9.95",
            "entry_points": [
                "detect",
                "extract",
                "build",
                "cluster",
                "analyze",
                "report",
                "export"
            ],
            "agents": [],
            "skills": [],
            "output": {
                "dir": "graphify-out/",
                "format": "graph.json"
            }
        },
        "humanizer": {
            "path": "humanizer",
            "type": "skill-only",
            "version": "3.1.0",
            "skills": [
                {
                    "name": "humanizer",
                    "path": "humanizer/SKILL.md"
                }
            ],
            "agents": [],
            "invocation": "embedded-mode"
        },
        "ponytail": {
            "path": "ponytail",
            "type": "plugin",
            "version": "5.3.2",
            "levels": [
                "lite",
                "full",
                "ultra"
            ],
            "skills": [
                {
                    "name": "ponytail",
                    "path": "ponytail/skills/ponytail/SKILL.md"
                },
                {
                    "name": "ponytail-audit",
                    "path": "ponytail/skills/ponytail-audit/SKILL.md"
                },
                {
                    "name": "ponytail-debt",
                    "path": "ponytail/skills/ponytail-debt/SKILL.md"
                },
                {
                    "name": "ponytail-gain",
                    "path": "ponytail/skills/ponytail-gain/SKILL.md"
                },
                {
                    "name": "ponytail-help",
                    "path": "ponytail/skills/ponytail-help/SKILL.md"
                },
                {
                    "name": "ponytail-review",
                    "path": "ponytail/skills/ponytail-review/SKILL.md"
                }
            ],
            "agents": []
        },
        "caveman": {
            "path": "caveman",
            "type": "plugin",
            "version": "4.0.1",
            "modes": [
                "caveman",
                "ultracave",
                "megacave"
            ],
            "skills": [
                {
                    "name": "cavecrew",
                    "path": "caveman/skills/cavecrew/SKILL.md"
                },
                {
                    "name": "caveman",
                    "path": "caveman/skills/caveman/SKILL.md"
                },
                {
                    "name": "caveman-commit",
                    "path": "caveman/skills/caveman-commit/SKILL.md"
                },
                {
                    "name": "caveman-compress",
                    "path": "caveman/skills/caveman-compress/SKILL.md"
                },
                {
                    "name": "caveman-discover",
                    "path": "caveman/skills/caveman-discover/SKILL.md"
                },
                {
                    "name": "caveman-evidence-review",
                    "path": "caveman/skills/caveman-evidence-review/SKILL.md"
                },
                {
                    "name": "caveman-explore",
                    "path": "caveman/skills/caveman-explore/SKILL.md"
                },
                {
                    "name": "caveman-help",
                    "path": "caveman/skills/caveman-help/SKILL.md"
                },
                {
                    "name": "caveman-learn",
                    "path": "caveman/skills/caveman-learn/SKILL.md"
                },
                {
                    "name": "caveman-manage",
                    "path": "caveman/skills/caveman-manage/SKILL.md"
                },
                {
                    "name": "caveman-optimize",
                    "path": "caveman/skills/caveman-optimize/SKILL.md"
                },
                {
                    "name": "caveman-review",
                    "path": "caveman/skills/caveman-review/SKILL.md"
                },
                {
                    "name": "caveman-setup",
                    "path": "caveman/skills/caveman-setup/SKILL.md"
                },
                {
                    "name": "caveman-stats",
                    "path": "caveman/skills/caveman-stats/SKILL.md"
                },
                {
                    "name": "investigate-first",
                    "path": "caveman/skills/investigate-first/SKILL.md"
                },
                {
                    "name": "lean-build",
                    "path": "caveman/skills/lean-build/SKILL.md"
                },
                {
                    "name": "megacave",
                    "path": "caveman/skills/megacave/SKILL.md"
                },
                {
                    "name": "migration",
                    "path": "caveman/skills/migration/SKILL.md"
                },
                {
                    "name": "safe-refactor",
                    "path": "caveman/skills/safe-refactor/SKILL.md"
                },
                {
                    "name": "surgical-patch",
                    "path": "caveman/skills/surgical-patch/SKILL.md"
                },
                {
                    "name": "ultracave",
                    "path": "caveman/skills/ultracave/SKILL.md"
                },
                {
                    "name": "verify-and-stop",
                    "path": "caveman/skills/verify-and-stop/SKILL.md"
                }
            ],
            "agents": [
                "caveman/agents/cavecrew-builder.md",
                "caveman/agents/cavecrew-investigator.md",
                "caveman/agents/cavecrew-reviewer.md"
            ]
        },
        "agent-skills": {
            "path": "agent-skills",
            "type": "plugin",
            "version": "0.6.13",
            "skills": [
                {
                    "name": "api-and-interface-design",
                    "path": "agent-skills/skills/api-and-interface-design/SKILL.md"
                },
                {
                    "name": "browser-testing-with-devtools",
                    "path": "agent-skills/skills/browser-testing-with-devtools/SKILL.md"
                },
                {
                    "name": "ci-cd-and-automation",
                    "path": "agent-skills/skills/ci-cd-and-automation/SKILL.md"
                },
                {
                    "name": "code-review-and-quality",